{
  "schema_version": "codex-scope.upstream-snapshot.v1",
  "snapshot_id": "codex-2026-09-24-e0ef5a1a-corpus50",
  "agent": "codex",
  "upstream_repository": "openai/codex",
  "upstream_commit": "e0ef5a1a0f6421601baaa679fb37eddaa4e9c8c1",
  "upstream_version_if_known": "unknown",
  "evidence_date": "2026-09-24",
  "coverage": "partial_revalidation",
  "source_references": [
    "https://github.com/openai/codex/commit/e0ef5a1a0f6421601baaa679fb37eddaa4e9c8c1",
    "https://github.com/openai/codex/commit/1d87af5faa75c2c09785cd088353d3236333673f",
    "https://github.com/openai/codex/commit/94174e44cbc54cece45f6052328ca0c2cd7a8a2a",
    "https://github.com/openai/codex/commit/85e0661c3baacc62db7b006d2b8085b006d0795e"
  ],
  "semantic_rules": [
    {
      "rule_id": "codex.compatibility.unknown_version",
      "expected_outcome": "unresolved",
      "evidence_state": "carried_forward",
      "regression": false,
      "evidence_date": "2026-09-22",
      "evidence_commit_or_version": "94174e44cbc54cece45f6052328ca0c2cd7a8a2a",
      "semantic_signature": {
        "expected_outcome": "unresolved",
        "expected_behavior": "The compatibility matrix records tested_codex_version as unknown while pinning the tested upstream commit.",
        "supported_boundary": "Static evidence commit is known; installed Codex binary version was not deterministically detected in this inspection environment.",
        "unsupported_boundary": "No shell-out or heuristic version inference is allowed in the deterministic core."
      },
      "source_references": [
        "https://developers.openai.com/codex/cli/reference",
        "https://github.com/openai/codex/blob/94174e44cbc54cece45f6052328ca0c2cd7a8a2a/codex-rs/core/config.schema.json"
      ]
    },
    {
      "rule_id": "codex.config.approval_policy_never",
      "expected_outcome": "compatible",
      "evidence_state": "verified",
      "regression": false,
      "evidence_date": "2026-09-24",
      "evidence_commit_or_version": "94174e44cbc54cece45f6052328ca0c2cd7a8a2a",
      "semantic_signature": {
        "expected_outcome": "compatible",
        "expected_behavior": "The exact string \"never\" resolves as supported when selected by the profile.",
        "supported_boundary": "Recognition/provenance of the policy value.",
        "unsupported_boundary": "Runtime approval behavior is not executed by the inspector."
      },
      "source_references": [
        "https://developers.openai.com/codex/config-file/config-reference",
        "https://github.com/openai/codex/blob/94174e44cbc54cece45f6052328ca0c2cd7a8a2a/codex-rs/core/config.schema.json"
      ]
    },
    {
      "rule_id": "codex.config.approval_policy_on_failure_deprecated",
      "expected_outcome": "unsupported",
      "evidence_state": "carried_forward",
      "regression": true,
      "evidence_date": "2026-09-22",
      "evidence_commit_or_version": "94174e44cbc54cece45f6052328ca0c2cd7a8a2a",
      "semantic_signature": {
        "expected_outcome": "unsupported",
        "expected_behavior": "A selected profile carrying on-failure is labeled unsupported.",
        "supported_boundary": "Conservative current-surface classification; provenance remains visible.",
        "unsupported_boundary": "This does not claim that every historical/current binary rejects the deprecated value."
      },
      "source_references": [
        "https://developers.openai.com/codex/config-file/config-reference",
        "https://github.com/openai/codex/blob/94174e44cbc54cece45f6052328ca0c2cd7a8a2a/codex-rs/core/config.schema.json"
      ]
    },
    {
      "rule_id": "codex.config.approval_policy_on_request",
      "expected_outcome": "compatible",
      "evidence_state": "verified",
      "regression": false,
      "evidence_date": "2026-09-24",
      "evidence_commit_or_version": "94174e44cbc54cece45f6052328ca0c2cd7a8a2a",
      "semantic_signature": {
        "expected_outcome": "compatible",
        "expected_behavior": "The exact string \"on-request\" resolves as supported without coercion.",
        "supported_boundary": "Recognition/provenance of the policy value.",
        "unsupported_boundary": "Runtime approval prompting is not executed by the inspector."
      },
      "source_references": [
        "https://developers.openai.com/codex/config-file/config-reference",
        "https://github.com/openai/codex/blob/94174e44cbc54cece45f6052328ca0c2cd7a8a2a/codex-rs/core/config.schema.json"
      ]
    },
    {
      "rule_id": "codex.config.approval_policy_unknown_fail_closed",
      "expected_outcome": "compatible",
      "evidence_state": "verified",
      "regression": false,
      "evidence_date": "2026-09-24",
      "evidence_commit_or_version": "94174e44cbc54cece45f6052328ca0c2cd7a8a2a",
      "semantic_signature": {
        "expected_outcome": "compatible",
        "expected_behavior": "An undocumented string policy fails with UNSUPPORTED_CONFIG_VALUE.",
        "supported_boundary": "Fail-closed validation of string policy values.",
        "unsupported_boundary": "Structured granular approval-policy objects are tracked as unsupported rather than interpreted."
      },
      "source_references": [
        "https://developers.openai.com/codex/config-file/config-reference",
        "https://github.com/openai/codex/blob/94174e44cbc54cece45f6052328ca0c2cd7a8a2a/codex-rs/core/config.schema.json"
      ]
    },
    {
      "rule_id": "codex.config.approval_policy_untrusted_removed",
      "expected_outcome": "unsupported",
      "evidence_state": "carried_forward",
      "regression": true,
      "evidence_date": "2026-09-22",
      "evidence_commit_or_version": "94174e44cbc54cece45f6052328ca0c2cd7a8a2a",
      "semantic_signature": {
        "expected_outcome": "unsupported",
        "expected_behavior": "Codex Scope labels the explicit historical value unsupported instead of presenting it as a current resolved policy.",
        "supported_boundary": "Evidence reflects current docs on 2026-09-22.",
        "unsupported_boundary": "Historical Codex releases may have accepted this value; no version inference is performed."
      },
      "source_references": [
        "https://developers.openai.com/codex/config-file/config-reference",
        "https://developers.openai.com/codex/security",
        "https://github.com/openai/codex/blob/94174e44cbc54cece45f6052328ca0c2cd7a8a2a/codex-rs/core/config.schema.json"
      ]
    },
    {
      "rule_id": "codex.config.cli_precedence",
      "expected_outcome": "compatible",
      "evidence_state": "carried_forward",
      "regression": false,
      "evidence_date": "2026-09-22",
      "evidence_commit_or_version": "94174e44cbc54cece45f6052328ca0c2cd7a8a2a",
      "semantic_signature": {
        "expected_outcome": "compatible",
        "expected_behavior": "CLI approval_policy=never wins over project/profile/user/system/default candidates.",
        "supported_boundary": "Explicitly supplied CLI override list only.",
        "unsupported_boundary": "Unseen invocation flags remain unresolved unless invocation_complete is asserted."
      },
      "source_references": [
        "https://developers.openai.com/codex/cli/reference",
        "https://developers.openai.com/codex/config-file/config-basic",
        "https://github.com/openai/codex/tree/94174e44cbc54cece45f6052328ca0c2cd7a8a2a/codex-rs/config/src/loader"
      ]
    },
    {
      "rule_id": "codex.config.closest_project_wins",
      "expected_outcome": "compatible",
      "evidence_state": "carried_forward",
      "regression": false,
      "evidence_date": "2026-09-22",
      "evidence_commit_or_version": "94174e44cbc54cece45f6052328ca0c2cd7a8a2a",
      "semantic_signature": {
        "expected_outcome": "compatible",
        "expected_behavior": "The nested app/.codex/config.toml beats the project-root .codex/config.toml.",
        "supported_boundary": "Trusted local project config layers.",
        "unsupported_boundary": "Managed/cloud constraints that can override or constrain results remain unresolved/unsupported."
      },
      "source_references": [
        "https://developers.openai.com/codex/config-file/config-basic",
        "https://github.com/openai/codex/tree/94174e44cbc54cece45f6052328ca0c2cd7a8a2a/codex-rs/config/src/loader"
      ]
    },
    {
      "rule_id": "codex.config.codex_home_project_layer_exclusion",
      "expected_outcome": "compatible",
      "evidence_state": "carried_forward",
      "regression": true,
      "evidence_date": "2026-09-22",
      "evidence_commit_or_version": "dd6c1d3787aa3c8032f6e6496e2bf25c47ddb37a + current main",
      "semantic_signature": {
        "expected_outcome": "compatible",
        "expected_behavior": "The root .codex directory used as CODEX_HOME appears only as user config; a nested child project config can still win.",
        "supported_boundary": "Normalized/canonical best-effort local path identity.",
        "unsupported_boundary": "Filesystem identity races and exotic mount behavior are outside the deterministic boundary."
      },
      "source_references": [
        "https://github.com/openai/codex/commit/dd6c1d3787aa3c8032f6e6496e2bf25c47ddb37a",
        "https://github.com/openai/codex/tree/94174e44cbc54cece45f6052328ca0c2cd7a8a2a/codex-rs/config/src/loader"
      ]
    },
    {
      "rule_id": "codex.config.default_project_doc_fallback_filenames",
      "expected_outcome": "compatible",
      "evidence_state": "verified",
      "regression": false,
      "evidence_date": "2026-09-24",
      "evidence_commit_or_version": "94174e44cbc54cece45f6052328ca0c2cd7a8a2a",
      "semantic_signature": {
        "expected_outcome": "compatible",
        "expected_behavior": "With no configured override, project_doc_fallback_filenames resolves to [].",
        "supported_boundary": "Local documented default only.",
        "unsupported_boundary": "Runtime filesystem behavior for later user-configured fallback names is covered separately."
      },